Poker Hand #TM3008617366: Tournament #128711011, Daily Turbo $10 Hold'em No Limit - Level12(400/800) - 2024/02/26 13:20:31
Table '31' 8-max Seat #3 is the button
Seat 1: Hero (2,355 in chips)
Seat 3: 72a6d452 (23,947 in chips)
Seat 4: f86a37aa (6,623 in chips)
Seat 5: 6ceaaddf (10,639 in chips)
Seat 6: 48c61a16 (20,845 in chips)
Seat 7: 4fac73 (13,975 in chips)
Seat 8: 75256b83 (22,369 in chips)
75256b83: posts the ante 100
Hero: posts the ante 100
4fac73: posts the ante 100
6ceaaddf: posts the ante 100
72a6d452: posts the ante 100
f86a37aa: posts the ante 100
48c61a16: posts the ante 100
f86a37aa: posts small blind 400
6ceaaddf: posts big blind 800
*** HOLE CARDS ***
Dealt to Hero [Ad 6h]
Dealt to 72a6d452 
Dealt to f86a37aa 
Dealt to 6ceaaddf 
Dealt to 48c61a16 
Dealt to 4fac73 
Dealt to 75256b83 
48c61a16: folds
4fac73: folds
75256b83: folds
Hero: raises 1,455 to 2,255 and is all-in
72a6d452: calls 2,255
f86a37aa: folds
6ceaaddf: calls 1,455
*** FLOP *** [4s 3d 4c]
6ceaaddf: checks
72a6d452: checks
*** TURN *** [4s 3d 4c] [Th]
6ceaaddf: bets 2,596
72a6d452: calls 2,596
*** RIVER *** [4s 3d 4c Th] [Jd]
6ceaaddf: checks
72a6d452: bets 13,057
6ceaaddf: folds
Uncalled bet (13,057) returned to 72a6d452
72a6d452: shows [9c Tc] (Pair of Tens and Pair of Fours)
Hero: shows [Ad 6h] (Pair of Fours)
*** SHOWDOWN ***
72a6d452 collected 7,865 from pot
72a6d452 collected 5,192 from pot
*** SUMMARY ***
Total pot 13,057 | Rake 0 | Jackpot 0 | Bingo 0 | Fortune 0 | Tax 0
Board [4s 3d 4c Th Jd]
Seat 1: Hero showed [Ad 6h] and lost with Pair of Fours
Seat 3: 72a6d452 (button) showed [9c Tc] and won (13,057) with Pair of Tens and Pair of Fours
Seat 4: f86a37aa (small blind) folded before Flop
Seat 5: 6ceaaddf (big blind) folded on the River
Seat 6: 48c61a16 folded before Flop
Seat 7: 4fac73 folded before Flop
Seat 8: 75256b83 folded before Flop


Poker Hand #TM3008617259: Tournament #128711011, Daily Turbo $10 Hold'em No Limit - Level12(400/800) - 2024/02/26 13:19:37
Table '31' 8-max Seat #1 is the button
Seat 1: Hero (2,455 in chips)
Seat 3: 72a6d452 (24,447 in chips)
Seat 4: f86a37aa (8,323 in chips)
Seat 5: 6ceaaddf (10,739 in chips)
Seat 6: 48c61a16 (18,245 in chips)
Seat 7: 4fac73 (14,075 in chips)
Seat 8: 75256b83 (22,469 in chips)
75256b83: posts the ante 100
Hero: posts the ante 100
4fac73: posts the ante 100
6ceaaddf: posts the ante 100
f86a37aa: posts the ante 100
72a6d452: posts the ante 100
48c61a16: posts the ante 100
72a6d452: posts small blind 400
f86a37aa: posts big blind 800
*** HOLE CARDS ***
Dealt to Hero [Ts 4s]
Dealt to 72a6d452 
Dealt to f86a37aa 
Dealt to 6ceaaddf 
Dealt to 48c61a16 
Dealt to 4fac73 
Dealt to 75256b83 
6ceaaddf: folds
48c61a16: raises 800 to 1,600
4fac73: folds
75256b83: folds
Hero: folds
72a6d452: folds
f86a37aa: calls 800
*** FLOP *** [7h Qd 4h]
f86a37aa: checks
48c61a16: bets 2,150
f86a37aa: folds
Uncalled bet (2,150) returned to 48c61a16
*** SHOWDOWN ***
48c61a16 collected 4,300 from pot
*** SUMMARY ***
Total pot 4,300 | Rake 0 | Jackpot 0 | Bingo 0 | Fortune 0 | Tax 0
Board [7h Qd 4h]
Seat 1: Hero (button) folded before Flop
Seat 3: 72a6d452 (small blind) folded before Flop
Seat 4: f86a37aa (big blind) folded on the Flop
Seat 5: 6ceaaddf folded before Flop
Seat 6: 48c61a16 won (4,300)
Seat 7: 4fac73 folded before Flop
Seat 8: 75256b83 folded before Flop


Poker Hand #TM3008617078: Tournament #128711011, Daily Turbo $10 Hold'em No Limit - Level12(400/800) - 2024/02/26 13:18:20
Table '31' 8-max Seat #8 is the button
Seat 1: Hero (10,000 in chips)
Seat 2: 6379d41a (6,879 in chips)
Seat 3: 72a6d452 (24,547 in chips)
Seat 4: f86a37aa (8,423 in chips)
Seat 5: 6ceaaddf (10,839 in chips)
Seat 6: 48c61a16 (18,345 in chips)
Seat 7: 4fac73 (14,175 in chips)
Seat 8: 75256b83 (7,545 in chips)
75256b83: posts the ante 100
Hero: posts the ante 100
4fac73: posts the ante 100
6ceaaddf: posts the ante 100
f86a37aa: posts the ante 100
72a6d452: posts the ante 100
6379d41a: posts the ante 100
48c61a16: posts the ante 100
Hero: posts small blind 400
6379d41a: posts big blind 800
*** HOLE CARDS ***
Dealt to Hero [7d Ah]
Dealt to 6379d41a 
Dealt to 72a6d452 
Dealt to f86a37aa 
Dealt to 6ceaaddf 
Dealt to 48c61a16 
Dealt to 4fac73 
Dealt to 75256b83 
72a6d452: folds
f86a37aa: folds
6ceaaddf: folds
48c61a16: folds
4fac73: folds
75256b83: raises 6,645 to 7,445 and is all-in
Hero: calls 7,045
6379d41a: calls 5,979 and is all-in
75256b83: shows [Ts As]
Hero: shows [7d Ah]
6379d41a: shows [9d 9s]
*** FLOP *** [Js Kc Kd]
*** TURN *** [Js Kc Kd] [Qs]
*** RIVER *** [Js Kc Kd Qs] [Ad]
*** SHOWDOWN ***
75256b83 collected 21,137 from pot
75256b83 collected 1,332 from pot
*** SUMMARY ***
Total pot 22,469 | Rake 0 | Jackpot 0 | Bingo 0 | Fortune 0 | Tax 0
Board [Js Kc Kd Qs Ad]
Seat 1: Hero (small blind) showed [7d Ah] and lost with Pair of Aces and Pair of Kings
Seat 2: 6379d41a (big blind) showed [9d 9s] and lost with Pair of Kings and Pair of Nines
Seat 3: 72a6d452 folded before Flop
Seat 4: f86a37aa folded before Flop
Seat 5: 6ceaaddf folded before Flop
Seat 6: 48c61a16 folded before Flop
Seat 7: 4fac73 folded before Flop
Seat 8: 75256b83 (button) showed [Ts As] and won (22,469) with Aces-High Straight


