Game Hand #2519583816 - Tournament #33745021 - Holdem (No Limit) - Level 3 (700.00/1400.00) - 2025/08/04 12:31:06 UTC
Table '6' 8-max Seat #6 is the button
Seat 1: Psycho79 (95408.00)
Seat 2: s1mial (99205.00)
Seat 3: Voti (79841.00)
Seat 4: Millennials (100000.00)
Seat 5: HOVICHEK (89900.00)
Seat 6: opala1978 (94600.00)
Seat 7: DayWalker12345 (94379.00)
Seat 8: Goodmen (103634.00)
Psycho79 posts ante 175.00
s1mial posts ante 175.00
Voti posts ante 175.00
Millennials posts ante 175.00
HOVICHEK posts ante 175.00
opala1978 posts ante 175.00
DayWalker12345 posts ante 175.00
Goodmen posts ante 175.00
DayWalker12345 posts the small blind 700.00
Goodmen posts the big blind 1400.00
*** HOLE CARDS ***
Main pot 1400.00
Dealt to Millennials [Td 2h]
Psycho79 folds
s1mial folds
Voti raises 3220.00 to 3220.00
Millennials folds
HOVICHEK folds
opala1978 calls 3220.00
DayWalker12345 folds
Goodmen calls 1820.00
*** FLOP *** [As 9c Qc]
Main pot 11760.00
Goodmen checks
Voti bets 3528.00
opala1978 calls 3528.00
Goodmen folds
*** TURN *** [As 9c Qc] [Ts]
Main pot 18816.00
Voti checks
opala1978 bets 15919.00
Voti calls 15919.00
*** RIVER *** [As 9c Qc Ts] [3d]
Main pot 50654.00
Voti checks
opala1978 bets 71758.00 and is all-in
Voti folds
Uncalled bet (71758.00) returned to opala1978
opala1978 does not show
*** SUMMARY ***
Total pot 50654.00
Board [As 9c Qc Ts 3d]
Seat 1: Psycho79 folded on the Pre-Flop and did not bet
Seat 2: s1mial folded on the Pre-Flop and did not bet
Seat 3: Voti folded on the River
Seat 4: Millennials folded on the Pre-Flop and did not bet
Seat 5: HOVICHEK folded on the Pre-Flop and did not bet
Seat 6: opala1978 did not show and won 50654.00
Seat 7: DayWalker12345 (small blind) folded on the Pre-Flop
Seat 8: Goodmen (big blind) folded on the Flop

Game Hand #2519584167 - Tournament #33745021 - Holdem (No Limit) - Level 3 (700.00/1400.00) - 2025/08/04 12:32:52 UTC
Table '6' 8-max Seat #7 is the button
Seat 1: Psycho79 (95233.00)
Seat 2: s1mial (99030.00)
Seat 3: Voti (56999.00)
Seat 4: Millennials (99825.00)
Seat 5: HOVICHEK (89725.00)
Seat 6: opala1978 (122412.00)
Seat 7: DayWalker12345 (93504.00)
Seat 8: Goodmen (100239.00)
Psycho79 posts ante 175.00
s1mial posts ante 175.00
Voti posts ante 175.00
Millennials posts ante 175.00
HOVICHEK posts ante 175.00
opala1978 posts ante 175.00
DayWalker12345 posts ante 175.00
Goodmen posts ante 175.00
Goodmen posts the small blind 700.00
Psycho79 posts the big blind 1400.00
*** HOLE CARDS ***
Main pot 1400.00
Dealt to Millennials [Kc 9d]
s1mial folds
Voti raises 2800.00 to 2800.00
Millennials folds
HOVICHEK folds
opala1978 folds
DayWalker12345 folds
Goodmen folds
Psycho79 folds
Uncalled bet (1400.00) returned to Voti
Voti does not show
*** SUMMARY ***
Total pot 4900.00
Seat 1: Psycho79 (big blind) folded on the Pre-Flop
Seat 2: s1mial folded on the Pre-Flop and did not bet
Seat 3: Voti did not show and won 4900.00
Seat 4: Millennials folded on the Pre-Flop and did not bet
Seat 5: HOVICHEK folded on the Pre-Flop and did not bet
Seat 6: opala1978 folded on the Pre-Flop and did not bet
Seat 7: DayWalker12345 (button) folded on the Pre-Flop
Seat 8: Goodmen (small blind) folded on the Pre-Flop

Game Hand #2519584308 - Tournament #33745021 - Holdem (No Limit) - Level 3 (700.00/1400.00) - 2025/08/04 12:33:38 UTC
Table '6' 8-max Seat #8 is the button
Seat 1: Psycho79 (93658.00)
Seat 2: s1mial (98855.00)
Seat 3: Voti (60324.00)
Seat 4: Millennials (99650.00)
Seat 5: HOVICHEK (89550.00)
Seat 6: opala1978 (122237.00)
Seat 7: DayWalker12345 (93329.00)
Seat 8: Goodmen (99364.00)
Psycho79 posts ante 175.00
s1mial posts ante 175.00
Voti posts ante 175.00
Millennials posts ante 175.00
HOVICHEK posts ante 175.00
opala1978 posts ante 175.00
DayWalker12345 posts ante 175.00
Goodmen posts ante 175.00
Psycho79 posts the small blind 700.00
s1mial posts the big blind 1400.00
*** HOLE CARDS ***
Main pot 1400.00
Dealt to Millennials [8c 7s]
Voti folds
Millennials folds
HOVICHEK folds
opala1978 folds
DayWalker12345 raises 2800.00 to 2800.00
Goodmen calls 2800.00
Psycho79 folds
s1mial calls 1400.00
*** FLOP *** [9s Kd 2s]
Main pot 10500.00
s1mial checks
DayWalker12345 checks
Goodmen bets 3465.00
s1mial folds
DayWalker12345 raises 10430.00 to 10430.00
Goodmen calls 6965.00
*** TURN *** [9s Kd 2s] [6s]
Main pot 31360.00
DayWalker12345 bets 14112.00
Goodmen folds
Uncalled bet (14112.00) returned to DayWalker12345
DayWalker12345 does not show
*** SUMMARY ***
Total pot 31360.00
Board [9s Kd 2s 6s]
Seat 1: Psycho79 (small blind) folded on the Pre-Flop
Seat 2: s1mial (big blind) folded on the Flop
Seat 3: Voti folded on the Pre-Flop and did not bet
Seat 4: Millennials folded on the Pre-Flop and did not bet
Seat 5: HOVICHEK folded on the Pre-Flop and did not bet
Seat 6: opala1978 folded on the Pre-Flop and did not bet
Seat 7: DayWalker12345 did not show and won 31360.00
Seat 8: Goodmen (button) folded on the Turn

Game Hand #2519584637 - Tournament #33745021 - Holdem (No Limit) - Level 3 (700.00/1400.00) - 2025/08/04 12:35:20 UTC
Table '6' 8-max Seat #1 is the button
Seat 2: s1mial (95880.00)
Seat 3: Voti (60149.00)
Seat 4: Millennials (99475.00)
Seat 6: opala1978 (122062.00)
s1mial posts ante 175.00
Voti posts ante 175.00
Millennials posts ante 175.00
opala1978 posts ante 175.00
s1mial posts the small blind 700.00
Voti posts the big blind 1400.00
*** HOLE CARDS ***
Main pot 700.00
Dealt to Millennials [4c Ts]
Millennials folds
opala1978 raises 2800.00 to 2800.00
s1mial folds
Voti folds
Uncalled bet (1400.00) returned to opala1978
opala1978 does not show
*** SUMMARY ***
Total pot 4200.00
Seat 2: s1mial (small blind) folded on the Pre-Flop
Seat 3: Voti (big blind) folded on the Pre-Flop
Seat 4: Millennials folded on the Pre-Flop and did not bet
Seat 6: opala1978 did not show and won 4200.00

