Winamax Poker - Tournament "Super Freeroll Fase 2 - Dementes" buyIn: 0€ + 0€ level: 1 - HandId: #4177519757433503745-1-1754324678 - Holdem no limit (10/25) - 2025/08/04 16:24:38 UTC
Table: 'Super Freeroll Fase 2 - Dementes(972654614)#0' 6-max (real money) Seat #3 is the button
Seat 1: Ca part (400)
Seat 2: star-du-flop (400)
Seat 3: ExOtiiC_ (400)
Seat 4: iCantGoBack (400)
Seat 5: SERGIOLINO13 (400)
Seat 6: Chipo 73 (400)
*** ANTE/BLINDS ***
iCantGoBack posts small blind 10
SERGIOLINO13 posts big blind 25
Dealt to iCantGoBack [5c 4s]
*** PRE-FLOP *** 
Chipo 73 folds
Ca part raises 25 to 50
star-du-flop folds
ExOtiiC_ folds
iCantGoBack folds
SERGIOLINO13 folds
Ca part collected 85 from pot
*** SUMMARY ***
Total pot 85 | No rake
Seat 1: Ca part won 85


Winamax Poker - Tournament "Super Freeroll Fase 2 - Dementes" buyIn: 0€ + 0€ level: 1 - HandId: #4177519757433503745-2-1754324691 - Holdem no limit (10/25) - 2025/08/04 16:24:51 UTC
Table: 'Super Freeroll Fase 2 - Dementes(972654614)#0' 6-max (real money) Seat #4 is the button
Seat 1: Ca part (435)
Seat 2: star-du-flop (400)
Seat 3: ExOtiiC_ (400)
Seat 4: iCantGoBack (390)
Seat 5: SERGIOLINO13 (375)
Seat 6: Chipo 73 (400)
*** ANTE/BLINDS ***
SERGIOLINO13 posts small blind 10
Chipo 73 posts big blind 25
Dealt to iCantGoBack [Qh 9c]
*** PRE-FLOP *** 
Ca part folds
star-du-flop calls 25
ExOtiiC_ folds
iCantGoBack folds
SERGIOLINO13 calls 15
Chipo 73 checks
*** FLOP *** [Jh 5s Kh]
SERGIOLINO13 checks
Chipo 73 checks
star-du-flop bets 375 and is all-in
SERGIOLINO13 folds
Chipo 73 folds
star-du-flop collected 450 from pot
*** SUMMARY ***
Total pot 450 | No rake
Board: [Jh 5s Kh]
Seat 2: star-du-flop won 450


Winamax Poker - Tournament "Super Freeroll Fase 2 - Dementes" buyIn: 0€ + 0€ level: 1 - HandId: #4177519757433503745-3-1754324730 - Holdem no limit (10/25) - 2025/08/04 16:25:30 UTC
Table: 'Super Freeroll Fase 2 - Dementes(972654614)#0' 6-max (real money) Seat #5 is the button
Seat 1: Ca part (435)
Seat 2: star-du-flop (450)
Seat 3: ExOtiiC_ (400)
Seat 4: iCantGoBack (390)
Seat 5: SERGIOLINO13 (350)
Seat 6: Chipo 73 (375)
*** ANTE/BLINDS ***
Chipo 73 posts small blind 10
Ca part posts big blind 25
Dealt to iCantGoBack [Kh 6s]
*** PRE-FLOP *** 
star-du-flop folds
ExOtiiC_ calls 25
iCantGoBack folds
SERGIOLINO13 folds
Chipo 73 raises 50 to 75
Ca part folds
ExOtiiC_ calls 50
*** FLOP *** [Th 3d Jc]
Chipo 73 bets 175
ExOtiiC_ raises 150 to 325 and is all-in
Chipo 73 calls 125 and is all-in
*** TURN *** [Th 3d Jc][7c]
*** RIVER *** [Th 3d Jc 7c][Kd]
*** SHOW DOWN ***
ExOtiiC_ shows [Qs Jd] (One pair : Jacks)
Chipo 73 shows [Qd Js] (One pair : Jacks)
Chipo 73 collected 388 from main pot
ExOtiiC_ collected 412 from side pot 1
*** SUMMARY ***
Total pot 800 | No rake
Board: [Th 3d Jc 7c Kd]
Seat 3: ExOtiiC_ showed [Qs Jd] and won 412 with One pair : Jacks
Seat 6: Chipo 73 (small blind) showed [Qd Js] and won 388 with One pair : Jacks


Winamax Poker - Tournament "Super Freeroll Fase 2 - Dementes" buyIn: 0€ + 0€ level: 1 - HandId: #4177519757433503745-4-1754324759 - Holdem no limit (10/25) - 2025/08/04 16:25:59 UTC
Table: 'Super Freeroll Fase 2 - Dementes(972654614)#0' 6-max (real money) Seat #6 is the button
Seat 1: Ca part (410)
Seat 2: star-du-flop (450)
Seat 3: ExOtiiC_ (412)
Seat 4: iCantGoBack (390)
Seat 5: SERGIOLINO13 (350)
Seat 6: Chipo 73 (388)
*** ANTE/BLINDS ***
Ca part posts small blind 10
star-du-flop posts big blind 25
Dealt to iCantGoBack [2d 9c]
*** PRE-FLOP *** 
ExOtiiC_ folds
iCantGoBack folds
SERGIOLINO13 calls 25
Chipo 73 folds
Ca part folds
star-du-flop raises 425 to 450 and is all-in
SERGIOLINO13 calls 325 and is all-in
*** FLOP *** [Qs Js 2h]
*** TURN *** [Qs Js 2h][Ac]
*** RIVER *** [Qs Js 2h Ac][3c]
*** SHOW DOWN ***
star-du-flop shows [Ah Th] (One pair : Aces)
SERGIOLINO13 shows [2s Jd] (Two pairs : Jacks and 2)
SERGIOLINO13 collected 710 from main pot
star-du-flop collected 100 from side pot 1
*** SUMMARY ***
Total pot 810 | No rake
Board: [Qs Js 2h Ac 3c]
Seat 2: star-du-flop (big blind) showed [Ah Th] and won 100 with One pair : Aces
Seat 5: SERGIOLINO13 showed [2s Jd] and won 710 with Two pairs : Jacks and 2


Winamax Poker - Tournament "Super Freeroll Fase 2 - Dementes" buyIn: 0€ + 0€ level: 2 - HandId: #4177519757433503745-5-1754324778 - Holdem no limit (25/50) - 2025/08/04 16:26:18 UTC
Table: 'Super Freeroll Fase 2 - Dementes(972654614)#0' 6-max (real money) Seat #1 is the button
Seat 1: Ca part (400)
Seat 2: star-du-flop (100)
Seat 3: ExOtiiC_ (412)
Seat 4: iCantGoBack (390)
Seat 5: SERGIOLINO13 (710)
Seat 6: Chipo 73 (388)
*** ANTE/BLINDS ***
star-du-flop posts small blind 25
ExOtiiC_ posts big blind 50
Dealt to iCantGoBack [3s 4c]
*** PRE-FLOP *** 
iCantGoBack folds
SERGIOLINO13 calls 50
Chipo 73 raises 100 to 150
Ca part folds
star-du-flop calls 75 and is all-in
ExOtiiC_ calls 100
SERGIOLINO13 calls 100
*** FLOP *** [4h Ac 5c]
ExOtiiC_ bets 262 and is all-in
SERGIOLINO13 folds
Chipo 73 folds
*** TURN *** [4h Ac 5c][Ad]
*** RIVER *** [4h Ac 5c Ad][Jc]
*** SHOW DOWN ***
star-du-flop shows [Qc 4s] (Two pairs : Aces and 4)
ExOtiiC_ shows [As Tc] (Trips of Aces)
ExOtiiC_ collected 812 from pot
*** SUMMARY ***
Total pot 812 | No rake
Board: [4h Ac 5c Ad Jc]
Seat 2: star-du-flop (small blind) showed [Qc 4s] and lost with Two pairs : Aces and 4
Seat 3: ExOtiiC_ (big blind) showed [As Tc] and won 812 with Trips of Aces


Winamax Poker - Tournament "Super Freeroll Fase 2 - Dementes" buyIn: 0€ + 0€ level: 2 - HandId: #4177519757433503745-6-1754324821 - Holdem no limit (25/50) - 2025/08/04 16:27:01 UTC
Table: 'Super Freeroll Fase 2 - Dementes(972654614)#0' 6-max (real money) Seat #2 is the button
Seat 1: Ca part (400)
Seat 3: ExOtiiC_ (812)
Seat 4: iCantGoBack (390)
Seat 5: SERGIOLINO13 (560)
Seat 6: Chipo 73 (238)
*** ANTE/BLINDS ***
ExOtiiC_ posts small blind 25
iCantGoBack posts big blind 50
Dealt to iCantGoBack [4s As]
*** PRE-FLOP *** 
SERGIOLINO13 raises 510 to 560 and is all-in
Chipo 73 folds
Ca part folds
ExOtiiC_ folds
iCantGoBack calls 340 and is all-in
*** FLOP *** [Ts 9h 5s]
*** TURN *** [Ts 9h 5s][8c]
*** RIVER *** [Ts 9h 5s 8c][2c]
*** SHOW DOWN ***
iCantGoBack shows [4s As] (High card : Ace)
SERGIOLINO13 shows [2d Ad] (One pair : 2)
SERGIOLINO13 collected 975 from pot
*** SUMMARY ***
Total pot 975 | No rake
Board: [Ts 9h 5s 8c 2c]
Seat 4: iCantGoBack (big blind) showed [4s As] and lost with High card : Ace
Seat 5: SERGIOLINO13 showed [2d Ad] and won 975 with One pair : 2


