Poker Hand #TM346627831: Tournament #209963712, Daily Hyper $20 Hold'em No Limit - Level16(600/1,200) - 2025/06/07 19:38:14
Table '21' 6-max Seat #5 is the button
Seat 1: b7e2549d (17,310 in chips)
Seat 2: 3c8fc4c7 (9,490 in chips)
Seat 3: 9fb61340 (71,849 in chips)
Seat 4: 65f54e85 (35,452 in chips)
Seat 5: Hero (7,510 in chips)
Seat 6: a1e1937c (73,237 in chips)
9fb61340: posts the ante 180
3c8fc4c7: posts the ante 180
65f54e85: posts the ante 180
Hero: posts the ante 180
a1e1937c: posts the ante 180
b7e2549d: posts the ante 180
a1e1937c: posts small blind 600
b7e2549d: posts big blind 1,200
*** HOLE CARDS ***
Dealt to b7e2549d 
Dealt to 3c8fc4c7 
Dealt to 9fb61340 
Dealt to 65f54e85 
Dealt to Hero [Ts Kh]
Dealt to a1e1937c 
3c8fc4c7: folds
9fb61340: folds
65f54e85: folds
Hero: raises 6,130 to 7,330
a1e1937c: folds
b7e2549d: calls 6,130
Hero: shows [Ts Kh]
b7e2549d: shows [4s As]
*** FLOP *** [3c Qh Ah]
*** TURN *** [3c Qh Ah] [7h]
*** RIVER *** [3c Qh Ah 7h] [Td]
*** SHOWDOWN ***
b7e2549d collected 16,340 from pot
*** SUMMARY ***
Total pot 16,340 | Rake 0 | Jackpot 0 | Bingo 0 | Fortune 0 | Tax 0
Board [3c Qh Ah 7h Td]
Seat 1: b7e2549d (big blind) showed [4s As] and won (16,340) with a pair of Aces
Seat 2: 3c8fc4c7 folded before Flop
Seat 3: 9fb61340 folded before Flop
Seat 4: 65f54e85 folded before Flop
Seat 5: Hero (button) showed [Ts Kh] and lost with a pair of Tens
Seat 6: a1e1937c (small blind) folded before Flop


Poker Hand #TM346627796: Tournament #209963712, Daily Hyper $20 Hold'em No Limit - Level16(600/1,200) - 2025/06/07 19:36:53
Table '21' 6-max Seat #4 is the button
Seat 1: b7e2549d (17,490 in chips)
Seat 2: 3c8fc4c7 (9,670 in chips)
Seat 3: 9fb61340 (64,212 in chips)
Seat 4: 65f54e85 (35,632 in chips)
Seat 5: Hero (8,290 in chips)
Seat 6: a1e1937c (79,554 in chips)
9fb61340: posts the ante 180
3c8fc4c7: posts the ante 180
65f54e85: posts the ante 180
a1e1937c: posts the ante 180
Hero: posts the ante 180
b7e2549d: posts the ante 180
Hero: posts small blind 600
a1e1937c: posts big blind 1,200
*** HOLE CARDS ***
Dealt to b7e2549d 
Dealt to 3c8fc4c7 
Dealt to 9fb61340 
Dealt to 65f54e85 
Dealt to Hero [Ad 2c]
Dealt to a1e1937c 
b7e2549d: folds
3c8fc4c7: folds
9fb61340: raises 1,440 to 2,640
65f54e85: folds
Hero: folds
a1e1937c: calls 1,440
*** FLOP *** [7h Ts 8d]
a1e1937c: checks
9fb61340: checks
*** TURN *** [7h Ts 8d] [Ks]
a1e1937c: bets 3,497
9fb61340: calls 3,497
*** RIVER *** [7h Ts 8d Ks] [2h]
a1e1937c: checks
9fb61340: bets 10,466
a1e1937c: folds
Uncalled bet (10,466) returned to 9fb61340
*** SHOWDOWN ***
9fb61340 collected 13,954 from pot
*** SUMMARY ***
Total pot 13,954 | Rake 0 | Jackpot 0 | Bingo 0 | Fortune 0 | Tax 0
Board [7h Ts 8d Ks 2h]
Seat 1: b7e2549d folded before Flop
Seat 2: 3c8fc4c7 folded before Flop
Seat 3: 9fb61340 won (13,954)
Seat 4: 65f54e85 (button) folded before Flop
Seat 5: Hero (small blind) folded before Flop
Seat 6: a1e1937c (big blind) folded on the River


Poker Hand #TM346627785: Tournament #209963712, Daily Hyper $20 Hold'em No Limit - Level16(600/1,200) - 2025/06/07 19:36:30
Table '21' 6-max Seat #3 is the button
Seat 1: b7e2549d (17,670 in chips)
Seat 2: 3c8fc4c7 (9,850 in chips)
Seat 3: 9fb61340 (61,512 in chips)
Seat 4: 65f54e85 (36,412 in chips)
Seat 5: Hero (9,670 in chips)
Seat 6: a1e1937c (79,734 in chips)
9fb61340: posts the ante 180
3c8fc4c7: posts the ante 180
65f54e85: posts the ante 180
a1e1937c: posts the ante 180
Hero: posts the ante 180
b7e2549d: posts the ante 180
65f54e85: posts small blind 600
Hero: posts big blind 1,200
*** HOLE CARDS ***
Dealt to b7e2549d 
Dealt to 3c8fc4c7 
Dealt to 9fb61340 
Dealt to 65f54e85 
Dealt to Hero [9d 2h]
Dealt to a1e1937c 
a1e1937c: folds
b7e2549d: folds
3c8fc4c7: folds
9fb61340: raises 1,200 to 2,400
65f54e85: folds
Hero: folds
Uncalled bet (1,200) returned to 9fb61340
*** SHOWDOWN ***
9fb61340 collected 4,080 from pot
*** SUMMARY ***
Total pot 4,080 | Rake 0 | Jackpot 0 | Bingo 0 | Fortune 0 | Tax 0
Seat 1: b7e2549d folded before Flop
Seat 2: 3c8fc4c7 folded before Flop
Seat 3: 9fb61340 (button) collected (4,080)
Seat 4: 65f54e85 (small blind) folded before Flop
Seat 5: Hero (big blind) folded before Flop
Seat 6: a1e1937c folded before Flop


Poker Hand #TM346627778: Tournament #209963712, Daily Hyper $20 Hold'em No Limit - Level16(600/1,200) - 2025/06/07 19:36:11
Table '21' 6-max Seat #1 is the button
Seat 1: b7e2549d (17,850 in chips)
Seat 3: 9fb61340 (62,292 in chips)
Seat 4: 65f54e85 (35,092 in chips)
Seat 5: Hero (9,850 in chips)
Seat 6: a1e1937c (79,914 in chips)
9fb61340: posts the ante 180
65f54e85: posts the ante 180
a1e1937c: posts the ante 180
Hero: posts the ante 180
b7e2549d: posts the ante 180
9fb61340: posts small blind 600
65f54e85: posts big blind 1,200
*** HOLE CARDS ***
Dealt to b7e2549d 
Dealt to 9fb61340 
Dealt to 65f54e85 
Dealt to Hero [Qh 9c]
Dealt to a1e1937c 
Hero: folds
a1e1937c: folds
b7e2549d: folds
9fb61340: folds
Uncalled bet (600) returned to 65f54e85
*** SHOWDOWN ***
65f54e85 collected 2,100 from pot
*** SUMMARY ***
Total pot 2,100 | Rake 0 | Jackpot 0 | Bingo 0 | Fortune 0 | Tax 0
Seat 1: b7e2549d (button) folded before Flop
Seat 3: 9fb61340 (small blind) folded before Flop
Seat 4: 65f54e85 (big blind) collected (2,100)
Seat 5: Hero folded before Flop
Seat 6: a1e1937c folded before Flop


Poker Hand #TM346627749: Tournament #209963712, Daily Hyper $20 Hold'em No Limit - Level15(500/1,000) - 2025/06/07 19:35:15
Table '21' 6-max Seat #6 is the button
Seat 1: b7e2549d (8,700 in chips)
Seat 3: 9fb61340 (70,992 in chips)
Seat 4: 65f54e85 (35,242 in chips)
Seat 5: Hero (10,000 in chips)
Seat 6: a1e1937c (80,064 in chips)
9fb61340: posts the ante 150
65f54e85: posts the ante 150
a1e1937c: posts the ante 150
Hero: posts the ante 150
b7e2549d: posts the ante 150
b7e2549d: posts small blind 500
9fb61340: posts big blind 1,000
*** HOLE CARDS ***
Dealt to b7e2549d 
Dealt to 9fb61340 
Dealt to 65f54e85 
Dealt to Hero [6c 8d]
Dealt to a1e1937c 
65f54e85: folds
Hero: folds
a1e1937c: folds
b7e2549d: raises 7,550 to 8,550
9fb61340: calls 7,550
b7e2549d: shows [4s 9s]
9fb61340: shows [Kh 7s]
*** FLOP *** [4d Ts 6d]
*** TURN *** [4d Ts 6d] [3h]
*** RIVER *** [4d Ts 6d 3h] [8c]
*** SHOWDOWN ***
b7e2549d collected 17,850 from pot
*** SUMMARY ***
Total pot 17,850 | Rake 0 | Jackpot 0 | Bingo 0 | Fortune 0 | Tax 0
Board [4d Ts 6d 3h 8c]
Seat 1: b7e2549d (small blind) showed [4s 9s] and won (17,850) with a pair of Fours
Seat 3: 9fb61340 (big blind) showed [Kh 7s] and lost with King high
Seat 4: 65f54e85 folded before Flop
Seat 5: Hero folded before Flop
Seat 6: a1e1937c (button) folded before Flop


