Poker Hand #TM4699306022: Tournament #212754744, GGMasters $150, $1M GTD [2-Day Event] Hold'em No Limit - Level15(300/600) - 2025/06/22 22:17:05
Table '542' 8-max Seat #7 is the button
Seat 1: e45dfeff (22,737 in chips)
Seat 2: Hero (11,875 in chips)
Seat 3: 565f5ed9 (23,452 in chips)
Seat 4: 95eeda43 (66,769 in chips)
Seat 5: bf3beb09 (17,320 in chips)
Seat 6: 818c870d (16,260 in chips)
Seat 7: 2f9b21e8 (27,696 in chips)
565f5ed9: posts the ante 75
2f9b21e8: posts the ante 75
818c870d: posts the ante 75
e45dfeff: posts the ante 75
Hero: posts the ante 75
bf3beb09: posts the ante 75
95eeda43: posts the ante 75
e45dfeff: posts small blind 300
Hero: posts big blind 600
*** HOLE CARDS ***
Dealt to e45dfeff 
Dealt to Hero [Ad Tc]
Dealt to 565f5ed9 
Dealt to 95eeda43 
Dealt to bf3beb09 
Dealt to 818c870d 
Dealt to 2f9b21e8 
565f5ed9: folds
95eeda43: folds
bf3beb09: folds
818c870d: raises 600 to 1,200
2f9b21e8: folds
e45dfeff: folds
Hero: raises 10,600 to 11,800 and is all-in
818c870d: calls 10,600
Hero: shows [Ad Tc]
818c870d: shows [Jd Js]
*** FLOP *** [6c 8d 5c]
*** TURN *** [6c 8d 5c] [3d]
*** RIVER *** [6c 8d 5c 3d] [Jc]
*** SHOWDOWN ***
818c870d collected 24,425 from pot
*** SUMMARY ***
Total pot 24,425 | Rake 0 | Jackpot 0 | Bingo 0 | Fortune 0 | Tax 0
Board [6c 8d 5c 3d Jc]
Seat 1: e45dfeff (small blind) folded before Flop
Seat 2: Hero (big blind) showed [Ad Tc] and lost with Ace high
Seat 3: 565f5ed9 folded before Flop
Seat 4: 95eeda43 folded before Flop
Seat 5: bf3beb09 folded before Flop
Seat 6: 818c870d showed [Jd Js] and won (24,425) with three of a kind, Jacks
Seat 7: 2f9b21e8 (button) folded before Flop


Poker Hand #TM4699305956: Tournament #212754744, GGMasters $150, $1M GTD [2-Day Event] Hold'em No Limit - Level15(300/600) - 2025/06/22 22:16:25
Table '542' 8-max Seat #6 is the button
Seat 1: e45dfeff (22,812 in chips)
Seat 2: Hero (11,950 in chips)
Seat 3: 565f5ed9 (23,527 in chips)
Seat 4: 95eeda43 (61,208 in chips)
Seat 5: bf3beb09 (17,395 in chips)
Seat 6: 818c870d (16,335 in chips)
Seat 7: 2f9b21e8 (28,071 in chips)
Seat 8: cb8815af (4,811 in chips)
565f5ed9: posts the ante 75
2f9b21e8: posts the ante 75
818c870d: posts the ante 75
e45dfeff: posts the ante 75
cb8815af: posts the ante 75
Hero: posts the ante 75
bf3beb09: posts the ante 75
95eeda43: posts the ante 75
2f9b21e8: posts small blind 300
cb8815af: posts big blind 600
*** HOLE CARDS ***
Dealt to e45dfeff 
Dealt to Hero [9h Jc]
Dealt to 565f5ed9 
Dealt to 95eeda43 
Dealt to bf3beb09 
Dealt to 818c870d 
Dealt to 2f9b21e8 
Dealt to cb8815af 
e45dfeff: folds
Hero: folds
565f5ed9: folds
95eeda43: raises 600 to 1,200
bf3beb09: folds
818c870d: folds
2f9b21e8: folds
cb8815af: raises 3,536 to 4,736 and is all-in
95eeda43: calls 3,536
cb8815af: shows [6c 6h]
95eeda43: shows [Ah 8h]
*** FLOP *** [8c Td As]
*** TURN *** [8c Td As] [8s]
*** RIVER *** [8c Td As 8s] [3h]
*** SHOWDOWN ***
95eeda43 collected 10,372 from pot
*** SUMMARY ***
Total pot 10,372 | Rake 0 | Jackpot 0 | Bingo 0 | Fortune 0 | Tax 0
Board [8c Td As 8s 3h]
Seat 1: e45dfeff folded before Flop
Seat 2: Hero folded before Flop
Seat 3: 565f5ed9 folded before Flop
Seat 4: 95eeda43 showed [Ah 8h] and won (10,372) with a full house, Eights full of Aces
Seat 5: bf3beb09 folded before Flop
Seat 6: 818c870d (button) folded before Flop
Seat 7: 2f9b21e8 (small blind) folded before Flop
Seat 8: cb8815af (big blind) showed [6c 6h] and lost with two pair, Eights and Sixes


Poker Hand #TM4699305906: Tournament #212754744, GGMasters $150, $1M GTD [2-Day Event] Hold'em No Limit - Level15(300/600) - 2025/06/22 22:15:50
Table '542' 8-max Seat #5 is the button
Seat 1: e45dfeff (22,887 in chips)
Seat 2: Hero (9,925 in chips)
Seat 3: 565f5ed9 (23,602 in chips)
Seat 4: 95eeda43 (61,283 in chips)
Seat 5: bf3beb09 (17,470 in chips)
Seat 6: 818c870d (16,710 in chips)
Seat 7: 2f9b21e8 (29,346 in chips)
Seat 8: cb8815af (4,886 in chips)
565f5ed9: posts the ante 75
2f9b21e8: posts the ante 75
e45dfeff: posts the ante 75
818c870d: posts the ante 75
cb8815af: posts the ante 75
Hero: posts the ante 75
bf3beb09: posts the ante 75
95eeda43: posts the ante 75
818c870d: posts small blind 300
2f9b21e8: posts big blind 600
*** HOLE CARDS ***
Dealt to e45dfeff 
Dealt to Hero [Kc Kd]
Dealt to 565f5ed9 
Dealt to 95eeda43 
Dealt to bf3beb09 
Dealt to 818c870d 
Dealt to 2f9b21e8 
Dealt to cb8815af 
cb8815af: folds
e45dfeff: folds
Hero: raises 600 to 1,200
565f5ed9: folds
95eeda43: folds
bf3beb09: folds
818c870d: folds
2f9b21e8: calls 600
*** FLOP *** [4c Qd 2h]
2f9b21e8: checks
Hero: bets 825
2f9b21e8: folds
Uncalled bet (825) returned to Hero
*** SHOWDOWN ***
Hero collected 3,300 from pot
*** SUMMARY ***
Total pot 3,300 | Rake 0 | Jackpot 0 | Bingo 0 | Fortune 0 | Tax 0
Board [4c Qd 2h]
Seat 1: e45dfeff folded before Flop
Seat 2: Hero won (3,300)
Seat 3: 565f5ed9 folded before Flop
Seat 4: 95eeda43 folded before Flop
Seat 5: bf3beb09 (button) folded before Flop
Seat 6: 818c870d (small blind) folded before Flop
Seat 7: 2f9b21e8 (big blind) folded on the Flop
Seat 8: cb8815af folded before Flop


Poker Hand #TM4699305795: Tournament #212754744, GGMasters $150, $1M GTD [2-Day Event] Hold'em No Limit - Level15(300/600) - 2025/06/22 22:14:47
Table '542' 8-max Seat #4 is the button
Seat 1: e45dfeff (22,962 in chips)
Seat 2: Hero (10,000 in chips)
Seat 3: 565f5ed9 (23,677 in chips)
Seat 4: 95eeda43 (61,358 in chips)
Seat 5: bf3beb09 (17,845 in chips)
Seat 6: 818c870d (17,385 in chips)
Seat 7: 2f9b21e8 (13,998 in chips)
Seat 8: cb8815af (18,884 in chips)
565f5ed9: posts the ante 75
2f9b21e8: posts the ante 75
e45dfeff: posts the ante 75
818c870d: posts the ante 75
cb8815af: posts the ante 75
Hero: posts the ante 75
bf3beb09: posts the ante 75
95eeda43: posts the ante 75
bf3beb09: posts small blind 300
818c870d: posts big blind 600
*** HOLE CARDS ***
Dealt to e45dfeff 
Dealt to Hero [Qc As]
Dealt to 565f5ed9 
Dealt to 95eeda43 
Dealt to bf3beb09 
Dealt to 818c870d 
Dealt to 2f9b21e8 
Dealt to cb8815af 
2f9b21e8: calls 600
cb8815af: raises 2,025 to 2,625
e45dfeff: folds
Hero: folds
565f5ed9: folds
95eeda43: folds
bf3beb09: folds
818c870d: folds
2f9b21e8: raises 11,298 to 13,923 and is all-in
cb8815af: calls 11,298
2f9b21e8: shows [9s 9h]
cb8815af: shows [Ks Ac]
*** FLOP *** [4s Td 8d]
*** TURN *** [4s Td 8d] [Js]
*** RIVER *** [4s Td 8d Js] [7h]
*** SHOWDOWN ***
2f9b21e8 collected 29,346 from pot
*** SUMMARY ***
Total pot 29,346 | Rake 0 | Jackpot 0 | Bingo 0 | Fortune 0 | Tax 0
Board [4s Td 8d Js 7h]
Seat 1: e45dfeff folded before Flop
Seat 2: Hero folded before Flop
Seat 3: 565f5ed9 folded before Flop
Seat 4: 95eeda43 (button) folded before Flop
Seat 5: bf3beb09 (small blind) folded before Flop
Seat 6: 818c870d (big blind) folded before Flop
Seat 7: 2f9b21e8 showed [9s 9h] and won (29,346) with a straight, Jack to Seven
Seat 8: cb8815af showed [Ks Ac] and lost with Ace high


