PokerStars Hand #249070432403: Tournament #3714753588, €18+€2 EUR Hold'em No Limit - Level V (300/600) - 2024/02/24 16:36:50 BRT [2024/02/24 14:36:50 ET]
Table '3714753588 21' 8-max Seat #4 is the button
Seat 1: deiraisetonuts (50000 in chips) 
Seat 2: mubuf (91120 in chips) 
Seat 4: magician.kz (87507 in chips) 
Seat 5: b0t4n4hp0k3r (59821 in chips) 
Seat 6: Youth75020 (66687 in chips) 
Seat 7: bestmars (46034 in chips) 
Seat 8: duplex90 (60317 in chips) 
deiraisetonuts: posts the ante 75
mubuf: posts the ante 75
magician.kz: posts the ante 75
b0t4n4hp0k3r: posts the ante 75
Youth75020: posts the ante 75
bestmars: posts the ante 75
duplex90: posts the ante 75
b0t4n4hp0k3r: posts small blind 300
Youth75020: posts big blind 600
*** HOLE CARDS ***
Dealt to deiraisetonuts [Ts 4h]
bestmars: folds 
duplex90: raises 600 to 1200
deiraisetonuts: folds 
mubuf: folds 
magician.kz: calls 1200
b0t4n4hp0k3r: folds 
Youth75020: folds 
*** FLOP *** [As 2d 8d]
duplex90: checks 
magician.kz: bets 1186
duplex90: folds 
Uncalled bet (1186) returned to magician.kz
magician.kz collected 3825 from pot
magician.kz: doesn't show hand 
locojosele is disconnected 
*** SUMMARY ***
Total pot 3825 | Rake 0 
Board [As 2d 8d]
Seat 1: deiraisetonuts folded before Flop (didn't bet)
Seat 2: mubuf folded before Flop (didn't bet)
Seat 4: magician.kz (button) collected (3825)
Seat 5: b0t4n4hp0k3r (small blind) folded before Flop
Seat 6: Youth75020 (big blind) folded before Flop
Seat 7: bestmars folded before Flop (didn't bet)
Seat 8: duplex90 folded on the Flop



PokerStars Hand #249070449845: Tournament #3714753588, €18+€2 EUR Hold'em No Limit - Level V (300/600) - 2024/02/24 16:37:40 BRT [2024/02/24 14:37:40 ET]
Table '3714753588 21' 8-max Seat #5 is the button
Seat 1: deiraisetonuts (49925 in chips) 
Seat 2: mubuf (91045 in chips) 
Seat 3: locojosele (50000 in chips) 
Seat 4: magician.kz (90057 in chips) 
Seat 5: b0t4n4hp0k3r (59446 in chips) 
Seat 6: Youth75020 (66012 in chips) 
Seat 7: bestmars (45959 in chips) 
Seat 8: duplex90 (59042 in chips) 
deiraisetonuts: posts the ante 75
mubuf: posts the ante 75
locojosele: posts the ante 75
magician.kz: posts the ante 75
b0t4n4hp0k3r: posts the ante 75
Youth75020: posts the ante 75
bestmars: posts the ante 75
duplex90: posts the ante 75
Youth75020: posts small blind 300
bestmars: posts big blind 600
*** HOLE CARDS ***
Dealt to deiraisetonuts [Kh 4h]
duplex90: folds 
deiraisetonuts: folds 
mubuf: folds 
locojosele: folds 
magician.kz: folds 
b0t4n4hp0k3r: folds 
Youth75020: raises 600 to 1200
bestmars: folds 
Uncalled bet (600) returned to Youth75020
Youth75020 collected 1800 from pot
Youth75020: doesn't show hand 
*** SUMMARY ***
Total pot 1800 | Rake 0 
Seat 1: deiraisetonuts folded before Flop (didn't bet)
Seat 2: mubuf folded before Flop (didn't bet)
Seat 3: locojosele folded before Flop (didn't bet)
Seat 4: magician.kz folded before Flop (didn't bet)
Seat 5: b0t4n4hp0k3r (button) folded before Flop (didn't bet)
Seat 6: Youth75020 (small blind) collected (1800)
Seat 7: bestmars (big blind) folded before Flop
Seat 8: duplex90 folded before Flop (didn't bet)



PokerStars Hand #249070460133: Tournament #3714753588, €18+€2 EUR Hold'em No Limit - Level V (300/600) - 2024/02/24 16:38:10 BRT [2024/02/24 14:38:10 ET]
Table '3714753588 21' 8-max Seat #6 is the button
Seat 1: deiraisetonuts (49850 in chips) 
Seat 3: locojosele (49925 in chips) 
Seat 4: magician.kz (89982 in chips) 
Seat 5: b0t4n4hp0k3r (59371 in chips) 
Seat 6: Youth75020 (67137 in chips) 
Seat 7: bestmars (45284 in chips) 
Seat 8: duplex90 (58967 in chips) 
deiraisetonuts: posts the ante 75
locojosele: posts the ante 75
magician.kz: posts the ante 75
b0t4n4hp0k3r: posts the ante 75
Youth75020: posts the ante 75
bestmars: posts the ante 75
duplex90: posts the ante 75
bestmars: posts small blind 300
duplex90: posts big blind 600
*** HOLE CARDS ***
Dealt to deiraisetonuts [Qc Td]
deiraisetonuts: folds 
locojosele: folds 
magician.kz: folds 
b0t4n4hp0k3r: folds 
Youth75020: raises 720 to 1320
bestmars: calls 1020
duplex90: folds 
*** FLOP *** [8d Jd Kh]
bestmars: bets 1800
Youth75020: calls 1800
*** TURN *** [8d Jd Kh] [8h]
bestmars: bets 3683
Youth75020: calls 3683
*** RIVER *** [8d Jd Kh 8h] [8s]
bestmars: bets 6600
Youth75020: calls 6600
*** SHOW DOWN ***
bestmars: shows [Qs Ks] (a full house, Eights full of Kings)
Youth75020: mucks hand 
bestmars collected 27931 from pot
*** SUMMARY ***
Total pot 27931 | Rake 0 
Board [8d Jd Kh 8h 8s]
Seat 1: deiraisetonuts folded before Flop (didn't bet)
Seat 3: locojosele folded before Flop (didn't bet)
Seat 4: magician.kz folded before Flop (didn't bet)
Seat 5: b0t4n4hp0k3r folded before Flop (didn't bet)
Seat 6: Youth75020 (button) mucked [Qd Qh]
Seat 7: bestmars (small blind) showed [Qs Ks] and won (27931) with a full house, Eights full of Kings
Seat 8: duplex90 (big blind) folded before Flop



PokerStars Hand #249070481443: Tournament #3714753588, €18+€2 EUR Hold'em No Limit - Level V (300/600) - 2024/02/24 16:39:11 BRT [2024/02/24 14:39:11 ET]
Table '3714753588 21' 8-max Seat #7 is the button
Seat 1: deiraisetonuts (49775 in chips) 
Seat 3: locojosele (49850 in chips) 
Seat 4: magician.kz (89907 in chips) 
Seat 5: b0t4n4hp0k3r (59296 in chips) 
Seat 6: Youth75020 (53659 in chips) 
Seat 7: bestmars (59737 in chips) 
Seat 8: duplex90 (58292 in chips) 
deiraisetonuts: posts the ante 75
locojosele: posts the ante 75
magician.kz: posts the ante 75
b0t4n4hp0k3r: posts the ante 75
Youth75020: posts the ante 75
bestmars: posts the ante 75
duplex90: posts the ante 75
duplex90: posts small blind 300
deiraisetonuts: posts big blind 600
*** HOLE CARDS ***
Dealt to deiraisetonuts [3c 4c]
adrl76 is disconnected 
locojosele: folds 
magician.kz: folds 
b0t4n4hp0k3r: raises 720 to 1320
Youth75020: folds 
bestmars: folds 
duplex90: folds 
deiraisetonuts: calls 720
*** FLOP *** [Qh Ah 9h]
deiraisetonuts: checks 
b0t4n4hp0k3r: bets 1109
deiraisetonuts: folds 
Uncalled bet (1109) returned to b0t4n4hp0k3r
b0t4n4hp0k3r collected 3465 from pot
b0t4n4hp0k3r: doesn't show hand 
*** SUMMARY ***
Total pot 3465 | Rake 0 
Board [Qh Ah 9h]
Seat 1: deiraisetonuts (big blind) folded on the Flop
Seat 3: locojosele folded before Flop (didn't bet)
Seat 4: magician.kz folded before Flop (didn't bet)
Seat 5: b0t4n4hp0k3r collected (3465)
Seat 6: Youth75020 folded before Flop (didn't bet)
Seat 7: bestmars (button) folded before Flop (didn't bet)
Seat 8: duplex90 (small blind) folded before Flop



