Poker Hand #TM313375814: Tournament #209319729, 233-M: $55 Bounty Hunters Daily Main [8-Max] Hold'em No Limit - Level2(125/250) - 2025/05/29 18:52:52
Table '401' 8-max Seat #3 is the button
Seat 1: 6de4ea7e (24,485 in chips)
Seat 2: d1a0a9ac (24,380 in chips)
Seat 3: d3a271a3 (21,608 in chips)
Seat 4: 14df9710 (7,475 in chips)
Seat 5: 78b16130 (27,770 in chips)
Seat 6: Hero (23,735 in chips)
Seat 7: 8809293 (20,703 in chips)
Seat 8: fa2567b8 (26,785 in chips)
14df9710: posts the ante 35
fa2567b8: posts the ante 35
8809293: posts the ante 35
6de4ea7e: posts the ante 35
d3a271a3: posts the ante 35
Hero: posts the ante 35
78b16130: posts the ante 35
d1a0a9ac: posts the ante 35
14df9710: posts small blind 125
78b16130: posts big blind 250
*** HOLE CARDS ***
Dealt to 6de4ea7e 
Dealt to d1a0a9ac 
Dealt to d3a271a3 
Dealt to 14df9710 
Dealt to 78b16130 
Dealt to Hero [Kd Kc]
Dealt to 8809293 
Dealt to fa2567b8 
Hero: raises 250 to 500
8809293: folds
fa2567b8: calls 500
6de4ea7e: folds
d1a0a9ac: folds
d3a271a3: calls 500
14df9710: raises 6,940 to 7,440
78b16130: folds
Hero: calls 6,940
fa2567b8: raises 19,310 to 26,750
d3a271a3: folds
Hero: calls 16,260
Uncalled bet (3,050) returned to fa2567b8
fa2567b8: shows [Ks As]
14df9710: shows [2c 2s]
Hero: shows [Kd Kc]
*** FLOP *** [3d 2h 9c]
*** TURN *** [3d 2h 9c] [3s]
*** RIVER *** [3d 2h 9c 3s] [Ac]
*** SHOWDOWN ***
14df9710 collected 23,350 from pot
fa2567b8 collected 32,520 from pot
*** SUMMARY ***
Total pot 55,870 | Rake 0 | Jackpot 0 | Bingo 0 | Fortune 0 | Tax 0
Board [3d 2h 9c 3s Ac]
Seat 1: 6de4ea7e folded before Flop
Seat 2: d1a0a9ac folded before Flop
Seat 3: d3a271a3 (button) folded before Flop
Seat 4: 14df9710 (small blind) showed [2c 2s] and won (23,350) with a full house, Twos full of Threes
Seat 5: 78b16130 (big blind) folded before Flop
Seat 6: Hero showed [Kd Kc] and lost with two pair, Kings and Threes
Seat 7: 8809293 folded before Flop
Seat 8: fa2567b8 showed [Ks As] and won (32,520) with two pair, Aces and Threes


Poker Hand #TM313375701: Tournament #209319729, 233-M: $55 Bounty Hunters Daily Main [8-Max] Hold'em No Limit - Level2(125/250) - 2025/05/29 18:51:16
Table '401' 8-max Seat #2 is the button
Seat 1: 6de4ea7e (24,520 in chips)
Seat 2: d1a0a9ac (24,415 in chips)
Seat 3: d3a271a3 (20,113 in chips)
Seat 4: 14df9710 (7,760 in chips)
Seat 5: 78b16130 (27,805 in chips)
Seat 6: Hero (24,270 in chips)
Seat 7: 8809293 (20,738 in chips)
Seat 8: fa2567b8 (27,320 in chips)
14df9710: posts the ante 35
fa2567b8: posts the ante 35
8809293: posts the ante 35
6de4ea7e: posts the ante 35
d3a271a3: posts the ante 35
Hero: posts the ante 35
78b16130: posts the ante 35
d1a0a9ac: posts the ante 35
d3a271a3: posts small blind 125
14df9710: posts big blind 250
*** HOLE CARDS ***
Dealt to 6de4ea7e 
Dealt to d1a0a9ac 
Dealt to d3a271a3 
Dealt to 14df9710 
Dealt to 78b16130 
Dealt to Hero [7d Kd]
Dealt to 8809293 
Dealt to fa2567b8 
78b16130: folds
Hero: raises 250 to 500
8809293: folds
fa2567b8: calls 500
6de4ea7e: folds
d1a0a9ac: folds
d3a271a3: calls 375
14df9710: folds
*** FLOP *** [Th 2s Jh]
d3a271a3: checks
Hero: checks
fa2567b8: checks
*** TURN *** [Th 2s Jh] [Qh]
d3a271a3: checks
Hero: checks
fa2567b8: checks
*** RIVER *** [Th 2s Jh Qh] [9h]
d3a271a3: bets 1,000
Hero: folds
fa2567b8: folds
Uncalled bet (1,000) returned to d3a271a3
*** SHOWDOWN ***
d3a271a3 collected 2,030 from pot
*** SUMMARY ***
Total pot 2,030 | Rake 0 | Jackpot 0 | Bingo 0 | Fortune 0 | Tax 0
Board [Th 2s Jh Qh 9h]
Seat 1: 6de4ea7e folded before Flop
Seat 2: d1a0a9ac (button) folded before Flop
Seat 3: d3a271a3 (small blind) won (2,030)
Seat 4: 14df9710 (big blind) folded before Flop
Seat 5: 78b16130 folded before Flop
Seat 6: Hero folded on the River
Seat 7: 8809293 folded before Flop
Seat 8: fa2567b8 folded on the River


Poker Hand #TM313375540: Tournament #209319729, 233-M: $55 Bounty Hunters Daily Main [8-Max] Hold'em No Limit - Level2(125/250) - 2025/05/29 18:49:07
Table '401' 8-max Seat #1 is the button
Seat 1: 6de4ea7e (24,555 in chips)
Seat 2: d1a0a9ac (24,575 in chips)
Seat 3: d3a271a3 (24,420 in chips)
Seat 4: 14df9710 (8,420 in chips)
Seat 5: 78b16130 (27,840 in chips)
Seat 6: Hero (24,930 in chips)
Seat 7: 8809293 (14,846 in chips)
Seat 8: fa2567b8 (27,355 in chips)
14df9710: posts the ante 35
fa2567b8: posts the ante 35
8809293: posts the ante 35
6de4ea7e: posts the ante 35
d3a271a3: posts the ante 35
Hero: posts the ante 35
78b16130: posts the ante 35
d1a0a9ac: posts the ante 35
d1a0a9ac: posts small blind 125
d3a271a3: posts big blind 250
*** HOLE CARDS ***
Dealt to 6de4ea7e 
Dealt to d1a0a9ac 
Dealt to d3a271a3 
Dealt to 14df9710 
Dealt to 78b16130 
Dealt to Hero [9s Qs]
Dealt to 8809293 
Dealt to fa2567b8 
14df9710: raises 375 to 625
78b16130: folds
Hero: calls 625
8809293: calls 625
fa2567b8: folds
6de4ea7e: folds
d1a0a9ac: folds
d3a271a3: calls 375
*** FLOP *** [4d Jd 4h]
d3a271a3: checks
14df9710: checks
Hero: checks
8809293: bets 727
d3a271a3: calls 727
14df9710: folds
Hero: folds
*** TURN *** [4d Jd 4h] [8d]
d3a271a3: checks
8809293: checks
*** RIVER *** [4d Jd 4h 8d] [6d]
d3a271a3: bets 2,920
8809293: calls 2,920
d3a271a3: shows [Qc Ks] (a pair of Fours)
8809293: shows [5h 5d] (a flush Jack high)
*** SHOWDOWN ***
8809293 collected 10,199 from pot
*** SUMMARY ***
Total pot 10,199 | Rake 0 | Jackpot 0 | Bingo 0 | Fortune 0 | Tax 0
Board [4d Jd 4h 8d 6d]
Seat 1: 6de4ea7e (button) folded before Flop
Seat 2: d1a0a9ac (small blind) folded before Flop
Seat 3: d3a271a3 (big blind) showed [Qc Ks] and lost with a pair of Fours
Seat 4: 14df9710 folded on the Flop
Seat 5: 78b16130 folded before Flop
Seat 6: Hero folded on the Flop
Seat 7: 8809293 showed [5h 5d] and won (10,199) with a flush Jack high
Seat 8: fa2567b8 folded before Flop


Poker Hand #TM313375465: Tournament #209319729, 233-M: $55 Bounty Hunters Daily Main [8-Max] Hold'em No Limit - Level2(125/250) - 2025/05/29 18:48:06
Table '401' 8-max Seat #8 is the button
Seat 1: 6de4ea7e (24,715 in chips)
Seat 2: d1a0a9ac (24,860 in chips)
Seat 3: d3a271a3 (24,455 in chips)
Seat 4: 14df9710 (21,805 in chips)
Seat 5: 78b16130 (27,875 in chips)
Seat 6: Hero (24,965 in chips)
Seat 7: 8809293 (14,881 in chips)
Seat 8: fa2567b8 (13,385 in chips)
14df9710: posts the ante 35
fa2567b8: posts the ante 35
8809293: posts the ante 35
6de4ea7e: posts the ante 35
d3a271a3: posts the ante 35
Hero: posts the ante 35
78b16130: posts the ante 35
d1a0a9ac: posts the ante 35
6de4ea7e: posts small blind 125
d1a0a9ac: posts big blind 250
*** HOLE CARDS ***
Dealt to 6de4ea7e 
Dealt to d1a0a9ac 
Dealt to d3a271a3 
Dealt to 14df9710 
Dealt to 78b16130 
Dealt to Hero [Js 9h]
Dealt to 8809293 
Dealt to fa2567b8 
d3a271a3: folds
14df9710: raises 250 to 500
78b16130: folds
Hero: folds
8809293: folds
fa2567b8: raises 12,850 to 13,350
6de4ea7e: folds
d1a0a9ac: folds
14df9710: calls 12,850
fa2567b8: shows [Qs Ac]
14df9710: shows [Jd Ad]
*** FLOP *** [5h 7c 5s]
*** TURN *** [5h 7c 5s] [Tc]
*** RIVER *** [5h 7c 5s Tc] [9d]
*** SHOWDOWN ***
fa2567b8 collected 27,355 from pot
*** SUMMARY ***
Total pot 27,355 | Rake 0 | Jackpot 0 | Bingo 0 | Fortune 0 | Tax 0
Board [5h 7c 5s Tc 9d]
Seat 1: 6de4ea7e (small blind) folded before Flop
Seat 2: d1a0a9ac (big blind) folded before Flop
Seat 3: d3a271a3 folded before Flop
Seat 4: 14df9710 showed [Jd Ad] and lost with a pair of Fives
Seat 5: 78b16130 folded before Flop
Seat 6: Hero folded before Flop
Seat 7: 8809293 folded before Flop
Seat 8: fa2567b8 (button) showed [Qs Ac] and won (27,355) with a pair of Fives


Poker Hand #TM313375428: Tournament #209319729, 233-M: $55 Bounty Hunters Daily Main [8-Max] Hold'em No Limit - Level2(125/250) - 2025/05/29 18:47:36
Table '401' 8-max Seat #7 is the button
Seat 1: 6de4ea7e (25,000 in chips)
Seat 2: d1a0a9ac (24,895 in chips)
Seat 3: d3a271a3 (25,115 in chips)
Seat 4: 14df9710 (20,560 in chips)
Seat 5: 78b16130 (27,910 in chips)
Seat 6: Hero (25,000 in chips)
Seat 7: 8809293 (14,916 in chips)
Seat 8: fa2567b8 (13,545 in chips)
14df9710: posts the ante 35
8809293: posts the ante 35
fa2567b8: posts the ante 35
6de4ea7e: posts the ante 35
d3a271a3: posts the ante 35
Hero: posts the ante 35
78b16130: posts the ante 35
d1a0a9ac: posts the ante 35
fa2567b8: posts small blind 125
6de4ea7e: posts big blind 250
*** HOLE CARDS ***
Dealt to 6de4ea7e 
Dealt to d1a0a9ac 
Dealt to d3a271a3 
Dealt to 14df9710 
Dealt to 78b16130 
Dealt to Hero [9c Qc]
Dealt to 8809293 
Dealt to fa2567b8 
d1a0a9ac: folds
d3a271a3: raises 375 to 625
14df9710: raises 1,429 to 2,054
78b16130: folds
Hero: folds
8809293: folds
fa2567b8: folds
6de4ea7e: folds
d3a271a3: folds
Uncalled bet (1,429) returned to 14df9710
*** SHOWDOWN ***
14df9710 collected 1,905 from pot
*** SUMMARY ***
Total pot 1,905 | Rake 0 | Jackpot 0 | Bingo 0 | Fortune 0 | Tax 0
Seat 1: 6de4ea7e (big blind) folded before Flop
Seat 2: d1a0a9ac folded before Flop
Seat 3: d3a271a3 folded before Flop
Seat 4: 14df9710 collected (1,905)
Seat 5: 78b16130 folded before Flop
Seat 6: Hero folded before Flop
Seat 7: 8809293 (button) folded before Flop
Seat 8: fa2567b8 (small blind) folded before Flop


