Game Hand #2025284272 - Tournament #31082331 - Holdem (No Limit) - Level 6 (1500.00/3000.00)- 2024/02/12 17:09:31 UTC
Table '53' 8-max Seat #3 is the button
Seat 1: NUMNUTZ001 (272766.00)
Seat 2: UBPOKER (145024.00)
Seat 3: lipesticky (455945.00)
Seat 5: TriHard (121529.00)
Seat 6: Byrd181 (237879.00)
Seat 7: MircoNovantotto (91931.00)
Seat 8: MALPARIDO (128450.00)
NUMNUTZ001 posts ante 450.00
UBPOKER posts ante 450.00
lipesticky posts ante 450.00
TriHard posts ante 450.00
Byrd181 posts ante 450.00
MircoNovantotto posts ante 450.00
MALPARIDO posts ante 450.00
TriHard posts the big blind 3000.00
*** HOLE CARDS ***
Main pot 3150.00
Dealt to lipesticky [3h 7c]
Byrd181 folds
MircoNovantotto folds
MALPARIDO folds
NUMNUTZ001 folds
UBPOKER folds
lipesticky folds
TriHard does not show
*** SUMMARY ***
Total pot 6150.00
Seat 1: NUMNUTZ001 folded on the Pre-Flop and did not bet
Seat 2: UBPOKER folded on the Pre-Flop and did not bet
Seat 3: lipesticky (button) folded on the Pre-Flop
Seat 5: TriHard did not show and won 6150.00
Seat 6: Byrd181 folded on the Pre-Flop and did not bet
Seat 7: MircoNovantotto folded on the Pre-Flop and did not bet
Seat 8: MALPARIDO folded on the Pre-Flop and did not bet

Game Hand #2025284651 - Tournament #31082331 - Holdem (No Limit) - Level 6 (1500.00/3000.00)- 2024/02/12 17:09:58 UTC
Table '53' 8-max Seat #4 is the button
Seat 1: NUMNUTZ001 (272316.00)
Seat 2: UBPOKER (144574.00)
Seat 3: lipesticky (455495.00)
Seat 5: TriHard (124229.00)
Seat 6: Byrd181 (237429.00)
Seat 7: MircoNovantotto (91481.00)
Seat 8: MALPARIDO (128000.00)
NUMNUTZ001 posts ante 450.00
UBPOKER posts ante 450.00
lipesticky posts ante 450.00
TriHard posts ante 450.00
Byrd181 posts ante 450.00
MircoNovantotto posts ante 450.00
MALPARIDO posts ante 450.00
TriHard posts the small blind 1500.00
Byrd181 posts the big blind 3000.00
*** HOLE CARDS ***
Main pot 3150.00
Dealt to lipesticky [Kh 8h]
MircoNovantotto folds
MALPARIDO raises 6000.00 to 6000.00
NUMNUTZ001 raises 18000.00 to 18000.00
UBPOKER folds
lipesticky folds
TriHard folds
Byrd181 folds
MALPARIDO raises 121550.00 to 127550.00 and is all-in
NUMNUTZ001 folds
Uncalled bet (109550.00) returned to MALPARIDO
MALPARIDO does not show
*** SUMMARY ***
Total pot 43650.00
Seat 1: NUMNUTZ001 folded on the Pre-Flop and did not bet
Seat 2: UBPOKER folded on the Pre-Flop and did not bet
Seat 3: lipesticky folded on the Pre-Flop and did not bet
Seat 5: TriHard (small blind) folded on the Pre-Flop
Seat 6: Byrd181 (big blind) folded on the Pre-Flop
Seat 7: MircoNovantotto folded on the Pre-Flop and did not bet
Seat 8: MALPARIDO did not show and won 43650.00

Game Hand #2025285450 - Tournament #31082331 - Holdem (No Limit) - Level 6 (1500.00/3000.00)- 2024/02/12 17:10:59 UTC
Table '53' 8-max Seat #5 is the button
Seat 1: NUMNUTZ001 (253866.00)
Seat 2: UBPOKER (144124.00)
Seat 3: lipesticky (455045.00)
Seat 4: oomm (125000.00)
Seat 5: TriHard (122279.00)
Seat 6: Byrd181 (233979.00)
Seat 7: MircoNovantotto (91031.00)
Seat 8: MALPARIDO (153200.00)
NUMNUTZ001 posts ante 450.00
UBPOKER posts ante 450.00
lipesticky posts ante 450.00
oomm posts ante 450.00
TriHard posts ante 450.00
Byrd181 posts ante 450.00
MircoNovantotto posts ante 450.00
MALPARIDO posts ante 450.00
Byrd181 posts the small blind 1500.00
MircoNovantotto posts the big blind 3000.00
*** HOLE CARDS ***
Main pot 3600.00
Dealt to lipesticky [9h Th]
MALPARIDO folds
NUMNUTZ001 raises 6600.00 to 6600.00
UBPOKER folds
lipesticky calls 6600.00
oomm folds
TriHard folds
Byrd181 folds
MircoNovantotto calls 3600.00
*** FLOP *** [3c 9s Kd]
Main pot 24900.00
MircoNovantotto checks
NUMNUTZ001 bets 7725.00
lipesticky calls 7725.00
MircoNovantotto calls 7725.00
*** TURN *** [3c 9s Kd] [2d]
Main pot 48075.00
MircoNovantotto checks
NUMNUTZ001 checks
lipesticky checks
*** RIVER *** [3c 9s Kd 2d] [6d]
Main pot 48075.00
MircoNovantotto checks
NUMNUTZ001 checks
lipesticky checks
*** SHOW DOWN ***
Main pot 48075.00
NUMNUTZ001 shows [As Tc] (a high card, Ace high [As Kd Tc 9s 6d])
lipesticky shows [9h Th] (a pair of Nines [9s 9h Kd Th 6d])
MircoNovantotto shows [Jh Qh] (a high card, King high [Kd Qh Jh 9s 6d])
lipesticky collected 48075.00 from main pot
*** SUMMARY ***
Total pot 48075.00
Board [3c 9s Kd 2d 6d]
Seat 1: NUMNUTZ001 showed [As Tc] and lost with a high card, Ace high [As Kd Tc 9s 6d]
Seat 2: UBPOKER folded on the Pre-Flop and did not bet
Seat 3: lipesticky showed [9h Th] and won 48075.00 with a pair of Nines [9s 9h Kd Th 6d]
Seat 4: oomm folded on the Pre-Flop and did not bet
Seat 5: TriHard (button) folded on the Pre-Flop
Seat 6: Byrd181 (small blind) folded on the Pre-Flop
Seat 7: MircoNovantotto (big blind) showed [Jh Qh] and lost with a high card, King high [Kd Qh Jh 9s 6d]
Seat 8: MALPARIDO folded on the Pre-Flop and did not bet

Game Hand #2025287086 - Tournament #31082331 - Holdem (No Limit) - Level 6 (1500.00/3000.00)- 2024/02/12 17:13:01 UTC
Table '53' 8-max Seat #6 is the button
Seat 1: NUMNUTZ001 (239091.00)
Seat 2: UBPOKER (143674.00)
Seat 3: lipesticky (488345.00)
Seat 4: oomm (124550.00)
Seat 5: TriHard (121829.00)
Seat 6: Byrd181 (232029.00)
Seat 7: MircoNovantotto (76256.00)
Seat 8: MALPARIDO (152750.00)
NUMNUTZ001 posts ante 450.00
UBPOKER posts ante 450.00
lipesticky posts ante 450.00
oomm posts ante 450.00
TriHard posts ante 450.00
Byrd181 posts ante 450.00
MircoNovantotto posts ante 450.00
MALPARIDO posts ante 450.00
MircoNovantotto posts the small blind 1500.00
MALPARIDO posts the big blind 3000.00
*** HOLE CARDS ***
Main pot 3600.00
Dealt to lipesticky [9h 7h]
NUMNUTZ001 raises 6600.00 to 6600.00
UBPOKER folds
lipesticky folds
oomm folds
TriHard folds
Byrd181 calls 6600.00
MircoNovantotto folds
MALPARIDO folds
*** FLOP *** [5c Th 5h]
Main pot 21300.00
NUMNUTZ001 checks
Byrd181 checks
*** TURN *** [5c Th 5h] [6c]
Main pot 21300.00
NUMNUTZ001 bets 21300.00
Byrd181 folds
Uncalled bet (21300.00) returned to NUMNUTZ001
NUMNUTZ001 does not show
*** SUMMARY ***
Total pot 21300.00
Board [5c Th 5h 6c]
Seat 1: NUMNUTZ001 did not show and won 21300.00
Seat 2: UBPOKER folded on the Pre-Flop and did not bet
Seat 3: lipesticky folded on the Pre-Flop and did not bet
Seat 4: oomm folded on the Pre-Flop and did not bet
Seat 5: TriHard folded on the Pre-Flop and did not bet
Seat 6: Byrd181 (button) folded on the Turn
Seat 7: MircoNovantotto (small blind) folded on the Pre-Flop
Seat 8: MALPARIDO (big blind) folded on the Pre-Flop

