PokerStars Hand #248683418284: Tournament #3706941977, €9+€9+€2 EUR Hold'em No Limit - Level VII (100/200) - 2024/02/04 13:44:01 BRT [2024/02/04 11:44:01 ET]
Table '3706941977 25' 9-max Seat #2 is the button
Seat 1: deiraisetonuts (17812 in chips, €13.50 bounty) 
Seat 2: Durable162 (17775 in chips, €9 bounty) 
Seat 3: TomiQ77 (8935 in chips, €9 bounty) 
Seat 4: sarakawa (9500 in chips, €9 bounty) 
Seat 5: viniciuscsox (9900 in chips, €9 bounty) 
Seat 6: NBAnoSMOKE (10038 in chips, €9 bounty) 
Seat 7: sutiplay214 (2149 in chips, €9 bounty) 
Seat 8: 16dealers (7803 in chips, €9 bounty) 
Seat 9: sudumaluns (10790 in chips, €9 bounty) 
deiraisetonuts: posts the ante 25
Durable162: posts the ante 25
TomiQ77: posts the ante 25
sarakawa: posts the ante 25
viniciuscsox: posts the ante 25
NBAnoSMOKE: posts the ante 25
sutiplay214: posts the ante 25
16dealers: posts the ante 25
sudumaluns: posts the ante 25
TomiQ77: posts small blind 100
sarakawa: posts big blind 200
*** HOLE CARDS ***
Dealt to deiraisetonuts [5d Jc]
viniciuscsox: raises 240 to 440
NBAnoSMOKE: folds 
sutiplay214: folds 
16dealers: folds 
sudumaluns: folds 
deiraisetonuts: folds 
Durable162: folds 
TomiQ77: calls 340
sarakawa: folds 
*** FLOP *** [5s Ad 3d]
TomiQ77: checks 
viniciuscsox: bets 431
TomiQ77: folds 
Uncalled bet (431) returned to viniciuscsox
viniciuscsox collected 1305 from pot
viniciuscsox: doesn't show hand 
*** SUMMARY ***
Total pot 1305 | Rake 0 
Board [5s Ad 3d]
Seat 1: deiraisetonuts folded before Flop (didn't bet)
Seat 2: Durable162 (button) folded before Flop (didn't bet)
Seat 3: TomiQ77 (small blind) folded on the Flop
Seat 4: sarakawa (big blind) folded before Flop
Seat 5: viniciuscsox collected (1305)
Seat 6: NBAnoSMOKE folded before Flop (didn't bet)
Seat 7: sutiplay214 folded before Flop (didn't bet)
Seat 8: 16dealers folded before Flop (didn't bet)
Seat 9: sudumaluns folded before Flop (didn't bet)



PokerStars Hand #248683435955: Tournament #3706941977, €9+€9+€2 EUR Hold'em No Limit - Level VII (100/200) - 2024/02/04 13:44:52 BRT [2024/02/04 11:44:52 ET]
Table '3706941977 25' 9-max Seat #3 is the button
Seat 1: deiraisetonuts (17787 in chips, €13.50 bounty) 
Seat 2: Durable162 (17750 in chips, €9 bounty) 
Seat 3: TomiQ77 (8470 in chips, €9 bounty) 
Seat 4: sarakawa (9275 in chips, €9 bounty) 
Seat 5: viniciuscsox (10740 in chips, €9 bounty) 
Seat 6: NBAnoSMOKE (10013 in chips, €9 bounty) 
Seat 7: sutiplay214 (2124 in chips, €9 bounty) 
Seat 8: 16dealers (7778 in chips, €9 bounty) 
Seat 9: sudumaluns (10765 in chips, €9 bounty) 
deiraisetonuts: posts the ante 25
Durable162: posts the ante 25
TomiQ77: posts the ante 25
sarakawa: posts the ante 25
viniciuscsox: posts the ante 25
NBAnoSMOKE: posts the ante 25
sutiplay214: posts the ante 25
16dealers: posts the ante 25
sudumaluns: posts the ante 25
sarakawa: posts small blind 100
viniciuscsox: posts big blind 200
*** HOLE CARDS ***
Dealt to deiraisetonuts [Td 6s]
NBAnoSMOKE: folds 
sutiplay214: raises 1899 to 2099 and is all-in
16dealers: folds 
sudumaluns: folds 
deiraisetonuts: folds 
Durable162: calls 2099
TomiQ77: folds 
sarakawa: folds 
viniciuscsox: folds 
*** FLOP *** [Kc 9c 2c]
*** TURN *** [Kc 9c 2c] [9h]
*** RIVER *** [Kc 9c 2c 9h] [Jc]
*** SHOW DOWN ***
sutiplay214: shows [Js As] (two pair, Jacks and Nines)
Durable162: shows [Qh Ac] (a flush, Ace high)
Durable162 collected 4723 from pot
Durable162 wins €4.50 for eliminating sutiplay214 and their own bounty increases by €4.50 to €13.50
sutiplay214 finished the tournament
*** SUMMARY ***
Total pot 4723 | Rake 0 
Board [Kc 9c 2c 9h Jc]
Seat 1: deiraisetonuts folded before Flop (didn't bet)
Seat 2: Durable162 showed [Qh Ac] and won (4723) with a flush, Ace high
Seat 3: TomiQ77 (button) folded before Flop (didn't bet)
Seat 4: sarakawa (small blind) folded before Flop
Seat 5: viniciuscsox (big blind) folded before Flop
Seat 6: NBAnoSMOKE folded before Flop (didn't bet)
Seat 7: sutiplay214 showed [Js As] and lost with two pair, Jacks and Nines
Seat 8: 16dealers folded before Flop (didn't bet)
Seat 9: sudumaluns folded before Flop (didn't bet)



PokerStars Hand #248683451483: Tournament #3706941977, €9+€9+€2 EUR Hold'em No Limit - Level VII (100/200) - 2024/02/04 13:45:36 BRT [2024/02/04 11:45:36 ET]
Table '3706941977 25' 9-max Seat #4 is the button
Seat 1: deiraisetonuts (17762 in chips, €13.50 bounty) 
Seat 2: Durable162 (20349 in chips, €13.50 bounty) 
Seat 3: TomiQ77 (8445 in chips, €9 bounty) 
Seat 4: sarakawa (9150 in chips, €9 bounty) 
Seat 5: viniciuscsox (10515 in chips, €9 bounty) 
Seat 6: NBAnoSMOKE (9988 in chips, €9 bounty) 
Seat 8: 16dealers (7753 in chips, €9 bounty) 
Seat 9: sudumaluns (10740 in chips, €9 bounty) 
deiraisetonuts: posts the ante 25
Durable162: posts the ante 25
TomiQ77: posts the ante 25
sarakawa: posts the ante 25
viniciuscsox: posts the ante 25
NBAnoSMOKE: posts the ante 25
16dealers: posts the ante 25
sudumaluns: posts the ante 25
viniciuscsox: posts small blind 100
NBAnoSMOKE: posts big blind 200
*** HOLE CARDS ***
Dealt to deiraisetonuts [7h 7c]
Pedro&Ines10 is disconnected 
16dealers: folds 
sudumaluns: folds 
deiraisetonuts: raises 220 to 420
Durable162: folds 
TomiQ77: folds 
sarakawa: folds 
viniciuscsox: folds 
NBAnoSMOKE: folds 
Uncalled bet (220) returned to deiraisetonuts
deiraisetonuts collected 700 from pot
deiraisetonuts: doesn't show hand 
*** SUMMARY ***
Total pot 700 | Rake 0 
Seat 1: deiraisetonuts collected (700)
Seat 2: Durable162 folded before Flop (didn't bet)
Seat 3: TomiQ77 folded before Flop (didn't bet)
Seat 4: sarakawa (button) folded before Flop (didn't bet)
Seat 5: viniciuscsox (small blind) folded before Flop
Seat 6: NBAnoSMOKE (big blind) folded before Flop
Seat 8: 16dealers folded before Flop (didn't bet)
Seat 9: sudumaluns folded before Flop (didn't bet)



