PokerStars Hand #257174887932: Tournament #3914012687, $7.50+$8.00+$1.00 USD Hold'em No Limit - Level I (100/200) - 2025/08/01 17:45:00 BRT [2025/08/01 16:45:00 ET]
Table '3914012687 3' 8-max Seat #1 is the button
Seat 1: Dej420 (2000 in chips, $8 bounty) 
Seat 2: Skirmantas16 (2000 in chips, $8 bounty) 
Seat 3: blizzardo888 (2000 in chips, $8 bounty) 
Seat 4: sirasss (2000 in chips, $8 bounty) 
Seat 5: Editors1974 (2000 in chips, $8 bounty) 
Seat 6: Gabrielfs13 (2000 in chips, $8 bounty) 
Seat 7: nikicius (2000 in chips, $8 bounty) 
Dej420: posts the ante 30
Skirmantas16: posts the ante 30
blizzardo888: posts the ante 30
sirasss: posts the ante 30
Editors1974: posts the ante 30
Gabrielfs13: posts the ante 30
nikicius: posts the ante 30
Skirmantas16: posts small blind 100
blizzardo888: posts big blind 200
*** HOLE CARDS ***
Dealt to Gabrielfs13 [5d 3d]
sirasss: folds 
Editors1974: calls 200
Gabrielfs13: folds 
nikicius: raises 1768 to 1968
Dej420: folds 
Dej420 is sitting out
Skirmantas16: folds 
blizzardo888: folds 
Editors1974: raises 2 to 1970 and is all-in
nikicius: calls 2 and is all-in
*** FLOP *** [4h 7d 6d]
*** TURN *** [4h 7d 6d] [8h]
*** RIVER *** [4h 7d 6d 8h] [5h]
*** SHOW DOWN ***
Editors1974: shows [Qc Jc] (a straight, Four to Eight)
nikicius: shows [Jd Jh] (a straight, Four to Eight)
Editors1974 collected 2225 from pot
nikicius collected 2225 from pot
*** SUMMARY ***
Total pot 4450 | Rake 0 
Board [4h 7d 6d 8h 5h]
Seat 1: Dej420 (button) folded before Flop (didn't bet)
Seat 2: Skirmantas16 (small blind) folded before Flop
Seat 3: blizzardo888 (big blind) folded before Flop
Seat 4: sirasss folded before Flop (didn't bet)
Seat 5: Editors1974 showed [Qc Jc] and won (2225) with a straight, Four to Eight
Seat 6: Gabrielfs13 folded before Flop (didn't bet)
Seat 7: nikicius showed [Jd Jh] and won (2225) with a straight, Four to Eight



PokerStars Hand #257174900835: Tournament #3914012687, $7.50+$8.00+$1.00 USD Hold'em No Limit - Level I (100/200) - 2025/08/01 17:45:52 BRT [2025/08/01 16:45:52 ET]
Table '3914012687 3' 8-max Seat #2 is the button
Seat 1: Dej420 (1970 in chips, $8 bounty) is sitting out
Seat 2: Skirmantas16 (1870 in chips, $8 bounty) 
Seat 3: blizzardo888 (1770 in chips, $8 bounty) 
Seat 4: sirasss (1970 in chips, $8 bounty) 
Seat 5: Editors1974 (2225 in chips, $8 bounty) 
Seat 6: Gabrielfs13 (1970 in chips, $8 bounty) 
Seat 7: nikicius (2225 in chips, $8 bounty) 
Dej420: posts the ante 30
Skirmantas16: posts the ante 30
blizzardo888: posts the ante 30
sirasss: posts the ante 30
Editors1974: posts the ante 30
Gabrielfs13: posts the ante 30
nikicius: posts the ante 30
blizzardo888: posts small blind 100
sirasss: posts big blind 200
*** HOLE CARDS ***
Dealt to Gabrielfs13 [Td Kc]
Editors1974: folds 
Gabrielfs13: raises 1740 to 1940 and is all-in
nikicius: folds 
Dej420: folds 
Skirmantas16: folds 
blizzardo888: folds 
irmusca1 is disconnected 
sirasss: folds 
Uncalled bet (1740) returned to Gabrielfs13
Gabrielfs13 collected 710 from pot
Gabrielfs13: doesn't show hand 
*** SUMMARY ***
Total pot 710 | Rake 0 
Seat 1: Dej420 folded before Flop (didn't bet)
Seat 2: Skirmantas16 (button) folded before Flop (didn't bet)
Seat 3: blizzardo888 (small blind) folded before Flop
Seat 4: sirasss (big blind) folded before Flop
Seat 5: Editors1974 folded before Flop (didn't bet)
Seat 6: Gabrielfs13 collected (710)
Seat 7: nikicius folded before Flop (didn't bet)



PokerStars Hand #257174908076: Tournament #3914012687, $7.50+$8.00+$1.00 USD Hold'em No Limit - Level I (100/200) - 2025/08/01 17:46:22 BRT [2025/08/01 16:46:22 ET]
Table '3914012687 3' 8-max Seat #3 is the button
Seat 1: Dej420 (1940 in chips, $8 bounty) is sitting out
Seat 2: Skirmantas16 (1840 in chips, $8 bounty) 
Seat 3: blizzardo888 (1640 in chips, $8 bounty) 
Seat 4: sirasss (1740 in chips, $8 bounty) 
Seat 6: Gabrielfs13 (2450 in chips, $8 bounty) 
Seat 7: nikicius (2195 in chips, $8 bounty) 
Seat 8: irmusca1 (2000 in chips, $8 bounty) 
Dej420: posts the ante 30
Skirmantas16: posts the ante 30
blizzardo888: posts the ante 30
sirasss: posts the ante 30
Gabrielfs13: posts the ante 30
nikicius: posts the ante 30
irmusca1: posts the ante 30
sirasss: posts small blind 100
Gabrielfs13: posts big blind 200
*** HOLE CARDS ***
Dealt to Gabrielfs13 [Jh Qs]
nikicius: folds 
irmusca1: folds 
Dej420: folds 
Skirmantas16: raises 1610 to 1810 and is all-in
blizzardo888: calls 1610 and is all-in
sirasss: folds 
Gabrielfs13: calls 1610
*** FLOP *** [Kh 8c 5h]
*** TURN *** [Kh 8c 5h] [9d]
*** RIVER *** [Kh 8c 5h 9d] [8d]
*** SHOW DOWN ***
Gabrielfs13: shows [Jh Qs] (a pair of Eights)
Skirmantas16: shows [Ad 7s] (a pair of Eights - Ace kicker)
Skirmantas16 collected 400 from side pot
blizzardo888: shows [Qc Qd] (two pair, Queens and Eights)
blizzardo888 collected 5140 from main pot
*** SUMMARY ***
Total pot 5540 Main pot 5140. Side pot 400. | Rake 0 
Board [Kh 8c 5h 9d 8d]
Seat 1: Dej420 folded before Flop (didn't bet)
Seat 2: Skirmantas16 showed [Ad 7s] and won (400) with a pair of Eights
Seat 3: blizzardo888 (button) showed [Qc Qd] and won (5140) with two pair, Queens and Eights
Seat 4: sirasss (small blind) folded before Flop
Seat 6: Gabrielfs13 (big blind) showed [Jh Qs] and lost with a pair of Eights
Seat 7: nikicius folded before Flop (didn't bet)
Seat 8: irmusca1 folded before Flop (didn't bet)



PokerStars Hand #257174915851: Tournament #3914012687, $7.50+$8.00+$1.00 USD Hold'em No Limit - Level I (100/200) - 2025/08/01 17:46:53 BRT [2025/08/01 16:46:53 ET]
Table '3914012687 3' 8-max Seat #4 is the button
Seat 1: Dej420 (1910 in chips, $8 bounty) is sitting out
Seat 2: Skirmantas16 (400 in chips, $8 bounty) 
Seat 3: blizzardo888 (5140 in chips, $8 bounty) 
Seat 4: sirasss (1610 in chips, $8 bounty) 
Seat 6: Gabrielfs13 (610 in chips, $8 bounty) 
Seat 7: nikicius (2165 in chips, $8 bounty) 
Seat 8: irmusca1 (1970 in chips, $8 bounty) 
Dej420: posts the ante 30
Skirmantas16: posts the ante 30
blizzardo888: posts the ante 30
sirasss: posts the ante 30
Gabrielfs13: posts the ante 30
nikicius: posts the ante 30
irmusca1: posts the ante 30
Gabrielfs13: posts small blind 100
nikicius: posts big blind 200
*** HOLE CARDS ***
Dealt to Gabrielfs13 [Ah 3d]
Dej420 has returned
irmusca1: raises 1740 to 1940 and is all-in
Dej420: calls 1880 and is all-in
Skirmantas16: calls 370 and is all-in
blizzardo888: folds 
sirasss: folds 
Gabrielfs13: calls 480 and is all-in
nikicius: folds 
Uncalled bet (60) returned to irmusca1
*** FLOP *** [9s 9c 3h]
*** TURN *** [9s 9c 3h] [Kd]
TIGHTPRO87 is disconnected 
*** RIVER *** [9s 9c 3h Kd] [Td]
*** SHOW DOWN ***
irmusca1: shows [Jh Js] (two pair, Jacks and Nines)
Dej420: shows [3s 3c] (a full house, Threes full of Nines)
Dej420 collected 2600 from side pot-2 
Gabrielfs13: shows [Ah 3d] (two pair, Nines and Threes)
Dej420 collected 630 from side pot-1 
Skirmantas16: shows [Jc 7d] (a pair of Nines)
Dej420 collected 1890 from main pot
Dej420 wins $4 for eliminating Skirmantas16 and their own bounty increases by $4 to $12
Dej420 wins $4 for eliminating Gabrielfs13 and their own bounty increases by $4 to $16
Gabrielfs13 finished the tournament
Skirmantas16 finished the tournament
felipr is disconnected 
*** SUMMARY ***
Total pot 5120 Main pot 1890. Side pot-1 630. Side pot-2 2600. | Rake 0 
Board [9s 9c 3h Kd Td]
Seat 1: Dej420 showed [3s 3c] and won (5120) with a full house, Threes full of Nines
Seat 2: Skirmantas16 showed [Jc 7d] and lost with a pair of Nines
Seat 3: blizzardo888 folded before Flop (didn't bet)
Seat 4: sirasss (button) folded before Flop (didn't bet)
Seat 6: Gabrielfs13 (small blind) showed [Ah 3d] and lost with two pair, Nines and Threes
Seat 7: nikicius (big blind) folded before Flop
Seat 8: irmusca1 showed [Jh Js] and lost with two pair, Jacks and Nines



